{"$schema":"https://json-schema.org/draft/2020-12/schema","$id":"https://novel-production-os.local/schemas/ide-compatibility-matrix.v1.schema.json","title":"M7.2 IDE compatibility surrogate matrix","type":"object","required":["schema_version","ok","portable_core_cases","platform_matrices","platform_count","capability_count","vendor_runtime_executed","live_attestation_required","claims","report_hash"],"properties":{"schema_version":{"const":"ide-compatibility-matrix.v1"},"ok":{"type":"boolean"},"portable_core_cases":{"type":"array","minItems":10,"maxItems":10},"platform_matrices":{"type":"array","minItems":4,"maxItems":4},"platform_count":{"const":4},"capability_count":{"const":10},"vendor_runtime_executed":{"const":false},"live_attestation_required":{"const":true},"claims":{"type":"object"},"report_hash":{"type":"string","pattern":"^sha256:[0-9a-f]{64}$"}},"additionalProperties":false}
