{"capability_count":10,"claims":{"adapter_contract_tested":true,"real_vendor_ide_tested":false,"sandbox_enforcement_tested":false},"live_attestation_required":true,"ok":true,"platform_count":4,"platform_matrices":[{"cases":[{"capability":"skill_discovery","evidence_test_id":"tests.test_agent_layout.AgentLayoutTests.test_four_layouts_have_at_least_ten_passing_checks","status":"pass"},{"capability":"workspace_init","evidence_test_id":"tests.test_m0_cli.M0CliTests.test_init_creates_only_m0_layout","status":"pass"},{"capability":"context_pack","evidence_test_id":"tests.test_production.ProductionTests.test_plan_and_context_are_deterministic_and_scoped","status":"pass"},{"capability":"writer_candidate","evidence_test_id":"tests.test_writer_runtime.WriterRuntimeTests.test_offline_start_writes_only_candidate_run_artifacts","status":"pass"},{"capability":"writer_authority_guard","evidence_test_id":"tests.test_writer_runtime.WriterRuntimeTests.test_authority_mutation_is_detected_and_blocks_run","status":"pass"},{"capability":"hard_error_detection","evidence_test_id":"tests.test_hard_audit.HardAuditTests.test_dead_actor_rule","status":"pass"},{"capability":"hard_error_blocks_commit","evidence_test_id":"tests.test_soft_audit.SoftAuditTests.test_hard_failed_cannot_approve_but_can_request_rework","status":"pass"},{"capability":"projection_rebuild","evidence_test_id":"tests.test_projection.ProjectionTests.test_rebuild_is_logically_deterministic_and_survives_database_deletion","status":"pass"},{"capability":"interrupt_resume","evidence_test_id":"tests.test_writer_runtime.WriterRuntimeTests.test_failed_attempt_is_evidenced_and_resume_uses_new_attempt","status":"pass"},{"capability":"no_api_key_doctor","evidence_test_id":"tests.test_m0_cli.M0CliTests.test_doctor_no_api_key_returns_zero","status":"pass"}],"execution_mode":"portable_core_surrogate","passed":10,"platform":"antigravity","total":10,"vendor_runtime_executed":false},{"cases":[{"capability":"skill_discovery","evidence_test_id":"tests.test_agent_layout.AgentLayoutTests.test_four_layouts_have_at_least_ten_passing_checks","status":"pass"},{"capability":"workspace_init","evidence_test_id":"tests.test_m0_cli.M0CliTests.test_init_creates_only_m0_layout","status":"pass"},{"capability":"context_pack","evidence_test_id":"tests.test_production.ProductionTests.test_plan_and_context_are_deterministic_and_scoped","status":"pass"},{"capability":"writer_candidate","evidence_test_id":"tests.test_writer_runtime.WriterRuntimeTests.test_offline_start_writes_only_candidate_run_artifacts","status":"pass"},{"capability":"writer_authority_guard","evidence_test_id":"tests.test_writer_runtime.WriterRuntimeTests.test_authority_mutation_is_detected_and_blocks_run","status":"pass"},{"capability":"hard_error_detection","evidence_test_id":"tests.test_hard_audit.HardAuditTests.test_dead_actor_rule","status":"pass"},{"capability":"hard_error_blocks_commit","evidence_test_id":"tests.test_soft_audit.SoftAuditTests.test_hard_failed_cannot_approve_but_can_request_rework","status":"pass"},{"capability":"projection_rebuild","evidence_test_id":"tests.test_projection.ProjectionTests.test_rebuild_is_logically_deterministic_and_survives_database_deletion","status":"pass"},{"capability":"interrupt_resume","evidence_test_id":"tests.test_writer_runtime.WriterRuntimeTests.test_failed_attempt_is_evidenced_and_resume_uses_new_attempt","status":"pass"},{"capability":"no_api_key_doctor","evidence_test_id":"tests.test_m0_cli.M0CliTests.test_doctor_no_api_key_returns_zero","status":"pass"}],"execution_mode":"portable_core_surrogate","passed":10,"platform":"claude","total":10,"vendor_runtime_executed":false},{"cases":[{"capability":"skill_discovery","evidence_test_id":"tests.test_agent_layout.AgentLayoutTests.test_four_layouts_have_at_least_ten_passing_checks","status":"pass"},{"capability":"workspace_init","evidence_test_id":"tests.test_m0_cli.M0CliTests.test_init_creates_only_m0_layout","status":"pass"},{"capability":"context_pack","evidence_test_id":"tests.test_production.ProductionTests.test_plan_and_context_are_deterministic_and_scoped","status":"pass"},{"capability":"writer_candidate","evidence_test_id":"tests.test_writer_runtime.WriterRuntimeTests.test_offline_start_writes_only_candidate_run_artifacts","status":"pass"},{"capability":"writer_authority_guard","evidence_test_id":"tests.test_writer_runtime.WriterRuntimeTests.test_authority_mutation_is_detected_and_blocks_run","status":"pass"},{"capability":"hard_error_detection","evidence_test_id":"tests.test_hard_audit.HardAuditTests.test_dead_actor_rule","status":"pass"},{"capability":"hard_error_blocks_commit","evidence_test_id":"tests.test_soft_audit.SoftAuditTests.test_hard_failed_cannot_approve_but_can_request_rework","status":"pass"},{"capability":"projection_rebuild","evidence_test_id":"tests.test_projection.ProjectionTests.test_rebuild_is_logically_deterministic_and_survives_database_deletion","status":"pass"},{"capability":"interrupt_resume","evidence_test_id":"tests.test_writer_runtime.WriterRuntimeTests.test_failed_attempt_is_evidenced_and_resume_uses_new_attempt","status":"pass"},{"capability":"no_api_key_doctor","evidence_test_id":"tests.test_m0_cli.M0CliTests.test_doctor_no_api_key_returns_zero","status":"pass"}],"execution_mode":"portable_core_surrogate","passed":10,"platform":"cursor","total":10,"vendor_runtime_executed":false},{"cases":[{"capability":"skill_discovery","evidence_test_id":"tests.test_agent_layout.AgentLayoutTests.test_four_layouts_have_at_least_ten_passing_checks","status":"pass"},{"capability":"workspace_init","evidence_test_id":"tests.test_m0_cli.M0CliTests.test_init_creates_only_m0_layout","status":"pass"},{"capability":"context_pack","evidence_test_id":"tests.test_production.ProductionTests.test_plan_and_context_are_deterministic_and_scoped","status":"pass"},{"capability":"writer_candidate","evidence_test_id":"tests.test_writer_runtime.WriterRuntimeTests.test_offline_start_writes_only_candidate_run_artifacts","status":"pass"},{"capability":"writer_authority_guard","evidence_test_id":"tests.test_writer_runtime.WriterRuntimeTests.test_authority_mutation_is_detected_and_blocks_run","status":"pass"},{"capability":"hard_error_detection","evidence_test_id":"tests.test_hard_audit.HardAuditTests.test_dead_actor_rule","status":"pass"},{"capability":"hard_error_blocks_commit","evidence_test_id":"tests.test_soft_audit.SoftAuditTests.test_hard_failed_cannot_approve_but_can_request_rework","status":"pass"},{"capability":"projection_rebuild","evidence_test_id":"tests.test_projection.ProjectionTests.test_rebuild_is_logically_deterministic_and_survives_database_deletion","status":"pass"},{"capability":"interrupt_resume","evidence_test_id":"tests.test_writer_runtime.WriterRuntimeTests.test_failed_attempt_is_evidenced_and_resume_uses_new_attempt","status":"pass"},{"capability":"no_api_key_doctor","evidence_test_id":"tests.test_m0_cli.M0CliTests.test_doctor_no_api_key_returns_zero","status":"pass"}],"execution_mode":"portable_core_surrogate","passed":10,"platform":"codex","total":10,"vendor_runtime_executed":false}],"portable_core_cases":[{"capability":"skill_discovery","duration_seconds":0.055906,"exit_code":0,"passed":true,"stderr":"test_four_layouts_have_at_least_ten_passing_checks (tests.test_agent_layout.AgentLayoutTests.test_four_layouts_have_at_least_ten_passing_checks) ... ok\n\n----------------------------------------------------------------------\nRan 1 test in 0.001s\n\nOK\n","stdout":"","test_id":"tests.test_agent_layout.AgentLayoutTests.test_four_layouts_have_at_least_ten_passing_checks"},{"capability":"workspace_init","duration_seconds":0.114342,"exit_code":0,"passed":true,"stderr":"test_init_creates_only_m0_layout (tests.test_m0_cli.M0CliTests.test_init_creates_only_m0_layout) ... ok\n\n----------------------------------------------------------------------\nRan 1 test in 0.065s\n\nOK\n","stdout":"","test_id":"tests.test_m0_cli.M0CliTests.test_init_creates_only_m0_layout"},{"capability":"context_pack","duration_seconds":0.278116,"exit_code":0,"passed":true,"stderr":"test_plan_and_context_are_deterministic_and_scoped (tests.test_production.ProductionTests.test_plan_and_context_are_deterministic_and_scoped) ... ok\n\n----------------------------------------------------------------------\nRan 1 test in 0.188s\n\nOK\n","stdout":"","test_id":"tests.test_production.ProductionTests.test_plan_and_context_are_deterministic_and_scoped"},{"capability":"writer_candidate","duration_seconds":0.289314,"exit_code":0,"passed":true,"stderr":"test_offline_start_writes_only_candidate_run_artifacts (tests.test_writer_runtime.WriterRuntimeTests.test_offline_start_writes_only_candidate_run_artifacts) ... ok\n\n----------------------------------------------------------------------\nRan 1 test in 0.181s\n\nOK\n","stdout":"","test_id":"tests.test_writer_runtime.WriterRuntimeTests.test_offline_start_writes_only_candidate_run_artifacts"},{"capability":"writer_authority_guard","duration_seconds":0.303012,"exit_code":0,"passed":true,"stderr":"test_authority_mutation_is_detected_and_blocks_run (tests.test_writer_runtime.WriterRuntimeTests.test_authority_mutation_is_detected_and_blocks_run) ... ok\n\n----------------------------------------------------------------------\nRan 1 test in 0.180s\n\nOK\n","stdout":"","test_id":"tests.test_writer_runtime.WriterRuntimeTests.test_authority_mutation_is_detected_and_blocks_run"},{"capability":"hard_error_detection","duration_seconds":0.345186,"exit_code":0,"passed":true,"stderr":"test_dead_actor_rule (tests.test_hard_audit.HardAuditTests.test_dead_actor_rule) ... ok\n\n----------------------------------------------------------------------\nRan 1 test in 0.241s\n\nOK\n","stdout":"","test_id":"tests.test_hard_audit.HardAuditTests.test_dead_actor_rule"},{"capability":"hard_error_blocks_commit","duration_seconds":0.320559,"exit_code":0,"passed":true,"stderr":"test_hard_failed_cannot_approve_but_can_request_rework (tests.test_soft_